[
  {"id":"codex.prefix-command.at","tool":"codex","name":"@","display_name":"Mention workspace file","type":"prefix-command","category":"context","role":"File context","description":"Search workspace paths and attach the selected file to the prompt.","syntax":["@<path-query>"],"examples":[{"command":"@src/api.ts","explanation":"Search for and attach src/api.ts.","level":"minimal"}],"capabilities":["context.attach-file"],"maturity":"stable","availability":{"channels":["interactive"],"conditions":[]},"sources":[{"url":"https://learn.chatgpt.com/docs/developer-commands?surface=cli","kind":"official-docs"}],"verification":{"status":"officially-documented","last_verified":"2026-08-29","tested_version":null,"verified_by":["official-docs"]}},
  {"id":"codex.prefix-command.bang","tool":"codex","name":"!","display_name":"Run shell command","type":"prefix-command","category":"terminal","role":"Shell execution","description":"Run a local shell command under the current approval and sandbox settings.","syntax":["!<shell-command>"],"examples":[{"command":"!git status","explanation":"Run git status locally.","level":"minimal"}],"capabilities":["terminal.execute"],"maturity":"stable","availability":{"channels":["interactive"],"conditions":[]},"sources":[{"url":"https://learn.chatgpt.com/docs/developer-commands?surface=cli","kind":"official-docs"}],"verification":{"status":"officially-documented","last_verified":"2026-08-29","tested_version":null,"verified_by":["official-docs"]}},
  {"id":"codex.prefix-command.dollar","tool":"codex","name":"$","display_name":"Invoke skill","type":"prefix-command","category":"skills","role":"Explicit skill invocation","description":"Explicitly invoke a discovered Codex skill by name.","syntax":["$<skill-name>"],"examples":[{"command":"$pdf","explanation":"Invoke the discovered skill named pdf.","level":"minimal"}],"capabilities":["skills.manage"],"maturity":"stable","availability":{"channels":["interactive"],"conditions":["Requires a matching enabled skill."]},"sources":[{"url":"https://learn.chatgpt.com/docs/build-skills","kind":"official-docs"}],"verification":{"status":"officially-documented","last_verified":"2026-08-29","tested_version":null,"verified_by":["official-docs"]}},
  {"id":"codex.shortcut.draft-history","tool":"codex","name":"Up / Down","display_name":"Restore draft history","type":"shortcut","category":"session","role":"Prompt history navigation","description":"Restore previous prompt drafts in the composer.","syntax":["Up","Down"],"examples":[{"command":"Up","explanation":"Restore the previous draft.","level":"minimal"}],"maturity":"stable","availability":{"channels":["interactive"],"conditions":[]},"sources":[{"url":"https://learn.chatgpt.com/docs/developer-commands?surface=cli","kind":"official-docs"}],"verification":{"status":"officially-documented","last_verified":"2026-08-29","tested_version":null,"verified_by":["official-docs"]}},
  {"id":"codex.shortcut.history-search","tool":"codex","name":"Ctrl+R","display_name":"Search prompt history","type":"shortcut","category":"session","role":"Prompt history search","description":"Search prior prompts, using Enter to select and Esc to cancel.","syntax":["Ctrl+R"],"examples":[{"command":"Ctrl+R","explanation":"Open reverse prompt-history search.","level":"minimal"}],"maturity":"stable","availability":{"channels":["interactive"],"conditions":[]},"sources":[{"url":"https://learn.chatgpt.com/docs/developer-commands?surface=cli","kind":"official-docs"}],"verification":{"status":"officially-documented","last_verified":"2026-08-29","tested_version":null,"verified_by":["official-docs"]}},
  {"id":"codex.shortcut.copy-output","tool":"codex","name":"Ctrl+O","display_name":"Copy latest output","type":"shortcut","category":"terminal","role":"Output copying","description":"Copy the latest completed Codex output to the clipboard.","syntax":["Ctrl+O"],"examples":[{"command":"Ctrl+O","explanation":"Copy the latest completed response.","level":"minimal"}],"maturity":"stable","availability":{"channels":["interactive"],"conditions":[]},"sources":[{"url":"https://learn.chatgpt.com/docs/developer-commands?surface=cli","kind":"official-docs"}],"verification":{"status":"officially-documented","last_verified":"2026-08-29","tested_version":null,"verified_by":["official-docs"]}},
  {"id":"codex.shortcut.queue-prompt","tool":"codex","name":"Tab while working","display_name":"Queue next prompt","type":"shortcut","category":"session","role":"Turn steering","description":"Queue the next prompt or command while Codex is working.","syntax":["Tab"],"examples":[{"command":"Tab","explanation":"Queue the composed prompt for the next turn.","level":"minimal"}],"maturity":"stable","availability":{"channels":["interactive"],"conditions":["Applies while Codex is working."]},"sources":[{"url":"https://learn.chatgpt.com/docs/developer-commands?surface=cli","kind":"official-docs"}],"verification":{"status":"officially-documented","last_verified":"2026-08-29","tested_version":null,"verified_by":["official-docs"]}},
  {"id":"codex.shortcut.steer-turn","tool":"codex","name":"Enter while working","display_name":"Steer active turn","type":"shortcut","category":"session","role":"Turn steering","description":"Inject the composed instruction into the currently running turn.","syntax":["Enter"],"examples":[{"command":"Enter","explanation":"Send the composed instruction into the active turn.","level":"minimal"}],"maturity":"stable","availability":{"channels":["interactive"],"conditions":["Applies while Codex is working."]},"sources":[{"url":"https://learn.chatgpt.com/docs/developer-commands?surface=cli","kind":"official-docs"}],"verification":{"status":"officially-documented","last_verified":"2026-08-29","tested_version":null,"verified_by":["official-docs"]}},
  {"id":"codex.shortcut.fork-message","tool":"codex","name":"Esc, Esc","display_name":"Fork from prior message","type":"shortcut","category":"session","role":"Session branching","description":"With an empty composer, edit a previous user message and fork the conversation from it.","syntax":["Esc, Esc"],"examples":[{"command":"Esc, Esc","explanation":"Open prior-message editing and fork navigation.","level":"minimal"}],"capabilities":["session.fork"],"maturity":"stable","availability":{"channels":["interactive"],"conditions":["Composer must be empty."]},"sources":[{"url":"https://learn.chatgpt.com/docs/developer-commands?surface=cli","kind":"official-docs"}],"verification":{"status":"officially-documented","last_verified":"2026-08-29","tested_version":null,"verified_by":["official-docs"]}},
  {"id":"codex.shortcut.exit","tool":"codex","name":"Ctrl+C","display_name":"Exit Codex","type":"shortcut","category":"session","role":"Session exit","description":"Exit the Codex CLI.","syntax":["Ctrl+C"],"examples":[{"command":"Ctrl+C","explanation":"Exit the CLI.","level":"minimal"}],"maturity":"stable","availability":{"channels":["interactive"],"conditions":[]},"sources":[{"url":"https://learn.chatgpt.com/docs/developer-commands?surface=cli","kind":"official-docs"}],"verification":{"status":"officially-documented","last_verified":"2026-08-29","tested_version":null,"verified_by":["official-docs"]}},
  {"id":"codex.shortcut.clear-view","tool":"codex","name":"Ctrl+L","display_name":"Clear terminal view","type":"shortcut","category":"terminal","role":"Terminal redraw","description":"Clear the visible terminal without clearing chat context.","syntax":["Ctrl+L"],"examples":[{"command":"Ctrl+L","explanation":"Clear the terminal view while retaining the conversation.","level":"minimal"}],"maturity":"stable","availability":{"channels":["interactive"],"conditions":[]},"sources":[{"url":"https://learn.chatgpt.com/docs/developer-commands?surface=cli","kind":"official-docs"}],"verification":{"status":"officially-documented","last_verified":"2026-08-29","tested_version":null,"verified_by":["official-docs"]}},
  {"id":"codex.shortcut.raw-output","tool":"codex","name":"Alt+R","display_name":"Toggle raw output","type":"shortcut","category":"terminal","role":"Output display","description":"Toggle raw terminal scrollback output.","syntax":["Alt+R"],"examples":[{"command":"Alt+R","explanation":"Toggle raw-output mode.","level":"minimal"}],"maturity":"stable","availability":{"channels":["interactive"],"conditions":[]},"sources":[{"url":"https://learn.chatgpt.com/docs/developer-commands?surface=cli","kind":"official-docs"}],"verification":{"status":"officially-documented","last_verified":"2026-08-29","tested_version":null,"verified_by":["official-docs"]}}
]
