[
  {"id":"gemini-cli.cli-command.launch","tool":"gemini-cli","name":"gemini","display_name":"Start Gemini CLI","type":"cli-command","category":"session","role":"CLI launch","description":"Start Gemini CLI interactively with an optional initial query.","when_to_use":["Use this control when start Gemini CLI interactively with an optional initial query."],"syntax":["gemini [query...]"],"examples":[{"command":"gemini \"review this repository\"","explanation":"Start an interactive session with a query.","level":"minimal"}],"maturity":"stable","availability":{"channels":["cli","interactive"],"conditions":[]},"sources":[{"url":"https://github.com/google-gemini/gemini-cli/blob/main/docs/cli/cli-reference.md","kind":"official-source"}],"verification":{"status":"officially-documented","last_verified":"2026-08-29","tested_version":null,"verified_by":["official-source"]}},
  {"id":"gemini-cli.cli-subcommand.update","tool":"gemini-cli","name":"gemini update","display_name":"Update Gemini CLI","type":"cli-subcommand","parent_id":"gemini-cli.cli-command.launch","category":"system","role":"CLI update","description":"Update Gemini CLI to the latest release. The 0.58.0 binary registers no update command.","when_to_use":["Use this control when update Gemini CLI to the latest release."],"syntax":["gemini update"],"examples":[{"command":"gemini update","explanation":"Install the latest CLI update.","level":"minimal"}],"maturity":"removed","availability":{"channels":["cli"],"conditions":["Absent from the 0.58.0 CLI; the published cheatsheet still lists it."]},"sources":[{"url":"https://github.com/google-gemini/gemini-cli/blob/main/docs/cli/cli-reference.md","kind":"official-source"}],"verification":{"status":"officially-documented","last_verified":"2026-09-05","tested_version":"0.58.0","verified_by":["manual-test","official-docs"]},"version":{"introduced":null,"deprecated":null,"removed":"unknown","replacement":"Update through the package manager the CLI was installed with, for example npm install -g @google/gemini-cli."}},
  {"id":"gemini-cli.cli-subcommand.extensions","tool":"gemini-cli","name":"gemini extensions","display_name":"Manage extensions","type":"cli-subcommand","parent_id":"gemini-cli.cli-command.launch","category":"plugins","role":"Extension management","description":"Install, uninstall, list, update, enable, disable, link, create, or validate extensions.","when_to_use":["Use this control when install, uninstall, list, update, enable, disable, link, create, or validate extensions."],"syntax":["gemini extensions <subcommand>"],"examples":[{"command":"gemini extensions list","explanation":"List installed extensions.","level":"minimal"}],"maturity":"stable","availability":{"channels":["cli"],"conditions":[]},"sources":[{"url":"https://github.com/google-gemini/gemini-cli/blob/main/docs/cli/cli-reference.md","kind":"official-source"}],"verification":{"status":"officially-documented","last_verified":"2026-08-29","tested_version":null,"verified_by":["official-source"]}},
  {"id":"gemini-cli.cli-subcommand.mcp","tool":"gemini-cli","name":"gemini mcp","display_name":"Manage MCP servers","type":"cli-subcommand","parent_id":"gemini-cli.cli-command.launch","category":"mcp","role":"MCP management","description":"Add, remove, or list Gemini CLI MCP servers.","when_to_use":["Use this control when add, remove, or list Gemini CLI MCP servers."],"syntax":["gemini mcp <add|remove|list>"],"examples":[{"command":"gemini mcp list","explanation":"List configured MCP servers.","level":"minimal"}],"capabilities":["mcp.manage"],"maturity":"stable","availability":{"channels":["cli"],"conditions":[]},"sources":[{"url":"https://github.com/google-gemini/gemini-cli/blob/main/docs/cli/cli-reference.md","kind":"official-source"}],"verification":{"status":"officially-documented","last_verified":"2026-08-29","tested_version":null,"verified_by":["official-source"]}},
  {"id":"gemini-cli.cli-subcommand.skills","tool":"gemini-cli","name":"gemini skills","display_name":"Manage skills","type":"cli-subcommand","parent_id":"gemini-cli.cli-command.launch","category":"skills","role":"Skill management","description":"List, install, link, uninstall, enable, or disable Gemini CLI skills.","when_to_use":["Use this control when list, install, link, uninstall, enable, or disable Gemini CLI skills."],"syntax":["gemini skills <subcommand>"],"examples":[{"command":"gemini skills list --all","explanation":"List skills across scopes.","level":"minimal"}],"capabilities":["skills.manage"],"maturity":"stable","availability":{"channels":["cli"],"conditions":[]},"sources":[{"url":"https://github.com/google-gemini/gemini-cli/blob/main/docs/cli/cli-reference.md","kind":"official-source"}],"verification":{"status":"officially-documented","last_verified":"2026-08-29","tested_version":null,"verified_by":["official-source"]}},
  {"id":"gemini-cli.cli-flag.prompt","tool":"gemini-cli","name":"--prompt","display_name":"Run non-interactively","type":"cli-flag","aliases":["-p"],"category":"session","role":"Headless execution","description":"Run the supplied query in non-interactive mode.","when_to_use":["Use this control when run the supplied query in non-interactive mode."],"syntax":["gemini --prompt <text>"],"examples":[{"command":"gemini -p \"run the tests\"","explanation":"Run one headless prompt.","level":"minimal"}],"maturity":"stable","availability":{"channels":["cli"],"conditions":[]},"sources":[{"url":"https://github.com/google-gemini/gemini-cli/blob/main/docs/cli/cli-reference.md","kind":"official-source"}],"verification":{"status":"officially-documented","last_verified":"2026-08-29","tested_version":null,"verified_by":["official-source"]}},
  {"id":"gemini-cli.cli-flag.approval-mode","tool":"gemini-cli","name":"--approval-mode","display_name":"Set approval mode","type":"cli-flag","category":"permissions","role":"Approval control","description":"Select default, auto_edit, yolo, or plan approval behavior.","when_to_use":["Use this control when select default, auto_edit, yolo, or plan approval behavior."],"syntax":["gemini --approval-mode <default|auto_edit|yolo|plan>"],"examples":[{"command":"gemini --approval-mode plan","explanation":"Start with plan-mode approvals.","level":"minimal"}],"capabilities":["permissions.configure"],"maturity":"stable","availability":{"channels":["cli"],"conditions":["Plan requires Plan Mode support."]},"sources":[{"url":"https://github.com/google-gemini/gemini-cli/blob/main/docs/cli/cli-reference.md","kind":"official-source"}],"verification":{"status":"officially-documented","last_verified":"2026-08-29","tested_version":null,"verified_by":["official-source"]}},
  {"id":"gemini-cli.cli-flag.worktree","tool":"gemini-cli","name":"--worktree","display_name":"Start in worktree","type":"cli-flag","aliases":["-w"],"category":"worktrees","role":"Worktree creation","description":"Start Gemini CLI in a new Git worktree.","when_to_use":["Use this control when start Gemini CLI in a new Git worktree."],"syntax":["gemini --worktree [name]"],"examples":[{"command":"gemini --worktree auth-refactor","explanation":"Create an isolated auth-refactor worktree.","level":"minimal"}],"capabilities":["worktree.manage"],"maturity":"experimental","availability":{"channels":["cli"],"conditions":["Requires experimental.worktrees and Git."]},"sources":[{"url":"https://github.com/google-gemini/gemini-cli/blob/main/docs/cli/cli-reference.md","kind":"official-source"}],"verification":{"status":"officially-documented","last_verified":"2026-08-29","tested_version":null,"verified_by":["official-source"]}},
  {"id":"gemini-cli.config-file.project-settings","tool":"gemini-cli","name":".gemini/settings.json","display_name":"Gemini project settings","type":"config-file","category":"configuration","role":"Project configuration","description":"Configure Gemini CLI behavior for a project.","syntax":[".gemini/settings.json"],"maturity":"stable","availability":{"channels":["cli","interactive"],"conditions":[]},"sources":[{"url":"https://github.com/google-gemini/gemini-cli/blob/main/docs/reference/configuration.md","kind":"official-source"}],"verification":{"status":"officially-documented","last_verified":"2026-08-29","tested_version":null,"verified_by":["official-source"]}},
  {"id":"gemini-cli.instruction-file.gemini-md","tool":"gemini-cli","name":"GEMINI.md","display_name":"Gemini project instructions","type":"instruction-file","category":"project-instructions","role":"Hierarchical instructions","description":"Provide hierarchical instructional context loaded by Gemini CLI.","syntax":["GEMINI.md"],"maturity":"stable","availability":{"channels":["cli","interactive","ide"],"conditions":["The filename can be changed with context.fileName."]},"sources":[{"url":"https://github.com/google-gemini/gemini-cli/blob/main/docs/reference/configuration.md","kind":"official-source"}],"verification":{"status":"officially-documented","last_verified":"2026-08-29","tested_version":null,"verified_by":["official-source"]}},
  {"id":"gemini-cli.environment-variable.api-key","tool":"gemini-cli","name":"GEMINI_API_KEY","display_name":"Gemini API key","type":"environment-variable","category":"authentication","role":"API authentication","description":"Provide an API key for supported Gemini CLI authentication flows.","syntax":["GEMINI_API_KEY=<key>"],"maturity":"stable","availability":{"channels":["cli","interactive"],"conditions":[]},"sources":[{"url":"https://github.com/google-gemini/gemini-cli/blob/main/docs/reference/configuration.md","kind":"official-source"}],"verification":{"status":"officially-documented","last_verified":"2026-08-29","tested_version":null,"verified_by":["official-source"]}}
]
