[
  {"id":"github-copilot.cli-flag.model","tool":"github-copilot","name":"--model","display_name":"Select model","type":"cli-flag","category":"models","role":"Model selection","description":"Select the AI model for the Copilot CLI invocation.","syntax":["copilot --model <model>"],"examples":[{"command":"copilot --model <model>","explanation":"Start Copilot CLI with a model available to the current account.","level":"minimal"}],"capabilities":["model.select"],"maturity":"stable","availability":{"channels":["cli"],"conditions":["Available models depend on account and organization policy."]},"sources":[{"url":"https://docs.github.com/en/copilot/reference/copilot-cli-reference/cli-command-reference","kind":"official-docs"}],"verification":{"status":"officially-documented","last_verified":"2026-08-29","tested_version":null,"verified_by":["official-docs"]}},
  {"id":"github-copilot.cli-subcommand.login","tool":"github-copilot","name":"copilot login","display_name":"Log in to Copilot CLI","type":"cli-subcommand","parent_id":"github-copilot.cli-command.launch","category":"authentication","role":"Authentication","description":"Authenticate through OAuth, device code, web flow, or token input.","syntax":["copilot login [--host <url>] [--device-code|--web-flow|--with-token]"],"examples":[{"command":"copilot login --device-code","explanation":"Authenticate from a remote terminal.","level":"minimal"}],"capabilities":["auth.login"],"maturity":"stable","availability":{"channels":["cli"],"conditions":[]},"sources":[{"url":"https://docs.github.com/en/copilot/reference/copilot-cli-reference/cli-command-reference","kind":"official-docs"}],"verification":{"status":"officially-documented","last_verified":"2026-08-29","tested_version":null,"verified_by":["official-docs"]}},
  {"id":"github-copilot.cli-subcommand.completion","tool":"github-copilot","name":"copilot completion","display_name":"Generate shell completion","type":"cli-subcommand","parent_id":"github-copilot.cli-command.launch","category":"configuration","role":"Shell integration","description":"Print shell-completion setup for bash, zsh, or fish.","syntax":["copilot completion <bash|zsh|fish>"],"examples":[{"command":"copilot completion zsh","explanation":"Print zsh completion setup.","level":"minimal"}],"maturity":"stable","availability":{"channels":["cli"],"conditions":[]},"sources":[{"url":"https://docs.github.com/en/copilot/reference/copilot-cli-reference/cli-command-reference","kind":"official-docs"}],"verification":{"status":"officially-documented","last_verified":"2026-08-29","tested_version":null,"verified_by":["official-docs"]}},
  {"id":"github-copilot.cli-subcommand.help","tool":"github-copilot","name":"copilot help","display_name":"Show Copilot CLI help","type":"cli-subcommand","parent_id":"github-copilot.cli-command.launch","category":"help","role":"Command discovery","description":"Show general help or an official help topic.","syntax":["copilot help [topic]"],"examples":[{"command":"copilot help permissions","explanation":"Show permission help.","level":"minimal"}],"maturity":"stable","availability":{"channels":["cli"],"conditions":[]},"sources":[{"url":"https://docs.github.com/en/copilot/reference/copilot-cli-reference/cli-command-reference","kind":"official-docs"}],"verification":{"status":"officially-documented","last_verified":"2026-08-29","tested_version":null,"verified_by":["official-docs"]}},
  {"id":"github-copilot.cli-flag.allow-tool","tool":"github-copilot","name":"--allow-tool","display_name":"Allow tool pattern","type":"cli-flag","category":"permissions","role":"Tool permission","description":"Allow one tool or permission pattern without prompting.","syntax":["copilot --allow-tool=<pattern>"],"examples":[{"command":"copilot --allow-tool='shell(git:*)'","explanation":"Allow Git shell commands.","level":"minimal"}],"capabilities":["permissions.configure"],"maturity":"stable","availability":{"channels":["cli"],"conditions":[]},"sources":[{"url":"https://docs.github.com/en/copilot/reference/copilot-cli-reference/cli-command-reference","kind":"official-docs"}],"verification":{"status":"officially-documented","last_verified":"2026-08-29","tested_version":null,"verified_by":["official-docs"]}},
  {"id":"github-copilot.cli-flag.autopilot","tool":"github-copilot","name":"--autopilot","display_name":"Enable autopilot","type":"cli-flag","category":"planning","role":"Autonomous execution","description":"Continue working autonomously until task_complete is called, then return to interactive mode.","syntax":["copilot --autopilot"],"examples":[{"command":"copilot --autopilot","explanation":"Start with autopilot continuation enabled.","level":"minimal"}],"maturity":"stable","availability":{"channels":["cli"],"conditions":[]},"sources":[{"url":"https://docs.github.com/en/copilot/reference/copilot-cli-reference/cli-command-reference","kind":"official-docs"}],"verification":{"status":"officially-documented","last_verified":"2026-08-29","tested_version":null,"verified_by":["official-docs"]}},
  {"id":"github-copilot.config-file.user-settings","tool":"github-copilot","name":"$COPILOT_HOME/settings.json","display_name":"Copilot CLI user settings","type":"config-file","category":"configuration","role":"User configuration","description":"Store user-editable Copilot CLI settings; COPILOT_HOME defaults to ~/.copilot.","syntax":["$COPILOT_HOME/settings.json"],"maturity":"stable","availability":{"channels":["cli","interactive"],"conditions":[]},"sources":[{"url":"https://docs.github.com/en/copilot/reference/copilot-cli-reference/cli-command-reference","kind":"official-docs"}],"verification":{"status":"officially-documented","last_verified":"2026-08-29","tested_version":null,"verified_by":["official-docs"]}},
  {"id":"github-copilot.instruction-file.project-instructions","tool":"github-copilot","name":".github/copilot-instructions.md","display_name":"Copilot project instructions","type":"instruction-file","category":"project-instructions","role":"Project instructions","description":"Provide repository-specific guidance loaded by Copilot CLI and maintained by copilot init or /init.","syntax":[".github/copilot-instructions.md"],"maturity":"stable","availability":{"channels":["cli","interactive","ide"],"conditions":[]},"sources":[{"url":"https://docs.github.com/en/copilot/reference/copilot-cli-reference/cli-command-reference","kind":"official-docs"}],"verification":{"status":"officially-documented","last_verified":"2026-08-29","tested_version":null,"verified_by":["official-docs"]}},
  {"id":"github-copilot.environment-variable.copilot-home","tool":"github-copilot","name":"COPILOT_HOME","display_name":"Copilot home directory","type":"environment-variable","category":"configuration","role":"Storage-location override","description":"Override the Copilot CLI configuration directory.","syntax":["COPILOT_HOME=<path>"],"maturity":"stable","availability":{"channels":["cli","interactive"],"conditions":[]},"sources":[{"url":"https://docs.github.com/en/copilot/reference/copilot-cli-reference/cli-command-reference","kind":"official-docs"}],"verification":{"status":"officially-documented","last_verified":"2026-08-29","tested_version":null,"verified_by":["official-docs"]}}
]
