[
  {"id":"codex.cli-flag.dangerously-bypass-hook-trust","tool":"codex","name":"--dangerously-bypass-hook-trust","display_name":"Bypass hook trust","type":"cli-flag","category":"permissions","role":"Hook trust override","description":"Run enabled hooks without requiring persisted hook trust for this invocation.","syntax":["codex --dangerously-bypass-hook-trust"],"examples":[{"command":"codex --dangerously-bypass-hook-trust","explanation":"Use only in automation that has already vetted every enabled hook source.","level":"practical"}],"when_to_use":["Use only in controlled automation where hook sources are already trusted externally."],"when_not_to_use":["Do not use for ordinary local development or with unreviewed hooks."],"maturity":"conditional","availability":{"channels":["cli"],"conditions":["Intended for automation that already vets hook sources."]},"sources":[{"url":"https://learn.chatgpt.com/docs/developer-commands?surface=cli","kind":"official-docs"}],"verification":{"status":"officially-documented","last_verified":"2026-08-30","tested_version":null,"verified_by":["official-docs"]}},
  {"id":"codex.cli-flag.strict-config","tool":"codex","name":"--strict-config","display_name":"Reject unknown config fields","type":"cli-flag","category":"configuration","role":"Configuration validation","description":"Error when config.toml contains fields that this Codex version does not recognize.","syntax":["codex --strict-config"],"examples":[{"command":"codex --strict-config","explanation":"Fail fast in CI when configuration contains an unsupported field.","level":"practical"}],"when_to_use":["Validate configuration compatibility during upgrades or automated runs."],"maturity":"stable","availability":{"channels":["cli"],"conditions":["Supported by documented runtime commands including codex, exec, review, resume, fork, app-server, mcp-server, and exec-server."]},"sources":[{"url":"https://learn.chatgpt.com/docs/developer-commands?surface=cli","kind":"official-docs"}],"verification":{"status":"officially-documented","last_verified":"2026-08-30","tested_version":null,"verified_by":["official-docs"]}},
  {"id":"codex.cli-flag.bundled","tool":"codex","name":"--bundled","display_name":"Use bundled model catalog","type":"cli-flag","category":"models","role":"Model diagnostics","description":"Skip refreshing the model catalog and print only the catalog bundled with the current Codex binary.","syntax":["codex debug models --bundled"],"examples":[{"command":"codex debug models --bundled","explanation":"Inspect only models shipped with the current installation.","level":"minimal"}],"maturity":"experimental","availability":{"channels":["cli"],"conditions":["Used with codex debug models."]},"sources":[{"url":"https://learn.chatgpt.com/docs/developer-commands?surface=cli","kind":"official-docs"}],"verification":{"status":"officially-documented","last_verified":"2026-08-30","tested_version":null,"verified_by":["official-docs"]}},
  {"id":"codex.cli-flag.download-url","tool":"codex","name":"--download-url","display_name":"Override desktop installer URL","type":"cli-flag","category":"configuration","role":"Desktop installation override","description":"Override the ChatGPT desktop app installer URL used by codex app when installation is required.","syntax":["codex app --download-url <url>"],"examples":[{"command":"codex app --download-url https://downloads.example.test/codex.pkg","explanation":"Use a controlled installer endpoint during desktop-app setup.","level":"practical"}],"maturity":"conditional","availability":{"channels":["cli"],"conditions":["Advanced override for codex app installation."]},"sources":[{"url":"https://learn.chatgpt.com/docs/developer-commands?surface=cli","kind":"official-docs"}],"verification":{"status":"officially-documented","last_verified":"2026-08-30","tested_version":null,"verified_by":["official-docs"]}}
]
