[
  {"id":"github-copilot.prefix-command.bang","tool":"github-copilot","name":"!","display_name":"Run shell command","type":"prefix-command","category":"terminal","role":"Shell execution","description":"Execute a local shell command while bypassing Copilot; a bare exclamation mark enters shell mode.","when_to_use":["Use this control when execute a local shell command while bypassing Copilot; a bare exclamation mark enters shell mode."],"syntax":["! <command>","!"],"examples":[{"command":"! git status","explanation":"Run git status directly in the local shell.","level":"minimal"}],"capabilities":["terminal.execute"],"maturity":"stable","availability":{"channels":["interactive"],"conditions":[]},"sources":[{"url":"https://docs.github.com/en/copilot/reference/copilot-cli-reference/cli-command-reference","kind":"official-docs"}],"verification":{"status":"officially-documented","last_verified":"2026-08-29","tested_version":null,"verified_by":["official-docs"]}},
  {"id":"github-copilot.prefix-command.at","tool":"github-copilot","name":"@","display_name":"Attach file context","type":"prefix-command","category":"context","role":"File attachment","description":"Include a named file's contents in the prompt context.","when_to_use":["Use this control when include a named file's contents in the prompt context."],"syntax":["@ <filename>"],"examples":[{"command":"@ src/auth.ts","explanation":"Attach src/auth.ts to the prompt.","level":"minimal"}],"capabilities":["context.attach-file"],"maturity":"stable","availability":{"channels":["interactive"],"conditions":[]},"sources":[{"url":"https://docs.github.com/en/copilot/reference/copilot-cli-reference/cli-command-reference","kind":"official-docs"}],"verification":{"status":"officially-documented","last_verified":"2026-08-29","tested_version":null,"verified_by":["official-docs"]}}
]
