[
  {"id":"claude-code.prefix-command.bang","tool":"claude-code","name":"!","display_name":"Run shell command","type":"prefix-command","category":"terminal","role":"Shell execution","description":"Run a shell command directly from the Claude Code prompt.","when_to_use":["Use this control when run a shell command directly from the Claude Code prompt."],"syntax":["!<shell-command>"],"examples":[{"command":"!git status","explanation":"Run git status locally.","level":"minimal"}],"capabilities":["terminal.execute"],"maturity":"stable","availability":{"channels":["interactive"],"conditions":[]},"sources":[{"url":"https://code.claude.com/docs/en/interactive-mode","kind":"official-docs"}],"verification":{"status":"officially-documented","last_verified":"2026-08-29","tested_version":null,"verified_by":["official-docs"]}},
  {"id":"claude-code.prefix-command.at","tool":"claude-code","name":"@","display_name":"Mention file or session","type":"prefix-command","category":"context","role":"Context mention","description":"Mention a file or supported session context from the prompt.","when_to_use":["Use this control when mention a file or supported session context from the prompt."],"syntax":["@<path-or-session>"],"examples":[{"command":"@src/auth.ts","explanation":"Attach src/auth.ts as context.","level":"minimal"}],"capabilities":["context.attach-file"],"maturity":"stable","availability":{"channels":["interactive"],"conditions":[]},"sources":[{"url":"https://code.claude.com/docs/en/interactive-mode","kind":"official-docs"}],"verification":{"status":"officially-documented","last_verified":"2026-08-29","tested_version":null,"verified_by":["official-docs"]}}
]
