[
  {"id":"gemini-cli.config-option.plan-enabled","tool":"gemini-cli","name":"general.plan.enabled","display_name":"Enable Plan Mode","type":"config-option","category":"planning","role":"Plan-mode configuration","description":"Enable Plan Mode so planning can use a read-only safety boundary before implementation.","syntax":["{ \"general\": { \"plan\": { \"enabled\": true } } }"],"examples":[{"command":"{ \"general\": { \"plan\": { \"enabled\": true } } }","explanation":"Keep Plan Mode available in Gemini CLI.","level":"practical"}],"when_to_use":["Use when users should be able to plan without write-capable implementation tools."],"capabilities":["planning.start"],"maturity":"stable","availability":{"channels":["cli","interactive"],"conditions":["Changing this setting requires a restart."]},"sources":[{"url":"https://github.com/google-gemini/gemini-cli/blob/main/docs/reference/configuration.md","kind":"official-source"}],"verification":{"status":"officially-documented","last_verified":"2026-08-30","tested_version":null,"verified_by":["official-source"]}},
  {"id":"gemini-cli.config-option.model-name","tool":"gemini-cli","name":"model.name","display_name":"Default conversation model","type":"config-option","category":"models","role":"Model configuration","description":"Set the Gemini model used for conversations by default.","syntax":["{ \"model\": { \"name\": \"<model>\" } }"],"examples":[{"command":"{ \"model\": { \"name\": \"<available-model>\" } }","explanation":"Persist an account-available conversation model.","level":"practical"}],"when_to_use":["Use when automatic model selection is not appropriate for most sessions."],"when_not_to_use":["Use --model for a one-invocation override."],"capabilities":["model.select"],"maturity":"stable","availability":{"channels":["cli","interactive"],"conditions":["The configured model must be available to the account."]},"sources":[{"url":"https://github.com/google-gemini/gemini-cli/blob/main/docs/reference/configuration.md","kind":"official-source"}],"verification":{"status":"officially-documented","last_verified":"2026-08-30","tested_version":null,"verified_by":["official-source"]}},
  {"id":"gemini-cli.config-option.folder-trust-enabled","tool":"gemini-cli","name":"security.folderTrust.enabled","display_name":"Enable folder trust","type":"config-option","category":"permissions","role":"Workspace trust configuration","description":"Enable Gemini CLI's folder-trust tracking for workspaces.","syntax":["{ \"security\": { \"folderTrust\": { \"enabled\": true } } }"],"examples":[{"command":"{ \"security\": { \"folderTrust\": { \"enabled\": true } } }","explanation":"Require trust decisions for workspace-controlled configuration.","level":"practical"}],"when_to_use":["Keep enabled when opening repositories whose local configuration should not be trusted automatically."],"when_not_to_use":["Do not disable folder trust merely to suppress a prompt in unfamiliar repositories."],"capabilities":["permissions.configure"],"maturity":"stable","availability":{"channels":["cli","interactive"],"conditions":["Changing this setting requires a restart."]},"sources":[{"url":"https://github.com/google-gemini/gemini-cli/blob/main/docs/reference/configuration.md","kind":"official-source"}],"verification":{"status":"officially-documented","last_verified":"2026-08-30","tested_version":null,"verified_by":["official-source"]}}
]
