[
  {"id":"gemini-cli.slash-command.resume-debug","tool":"gemini-cli","name":"/resume debug","display_name":"Export the latest Gemini request","type":"slash-command","parent_id":"gemini-cli.slash-command.resume","category":"diagnostics","role":"Request diagnostics","description":"Export the most recent API request as a JSON payload.","syntax":["/resume debug"],"examples":[{"command":"/resume debug","explanation":"Capture the latest request payload while investigating an API issue.","level":"practical"}],"maturity":"stable","availability":{"channels":["interactive"],"conditions":[]},"sources":[{"url":"https://github.com/google-gemini/gemini-cli/blob/main/docs/reference/commands.md","kind":"official-source"}],"verification":{"status":"officially-documented","last_verified":"2026-08-30","tested_version":null,"verified_by":["official-source"]}},
  {"id":"gemini-cli.slash-command.resume-list","tool":"gemini-cli","name":"/resume list","display_name":"List Gemini checkpoints","type":"slash-command","parent_id":"gemini-cli.slash-command.resume","category":"session","role":"Checkpoint listing","description":"List manually saved checkpoint tags for the current project.","syntax":["/resume list"],"examples":[{"command":"/resume list","explanation":"Review named checkpoints available in the current project.","level":"practical"}],"maturity":"stable","availability":{"channels":["interactive"],"conditions":["Only checkpoints saved in the current project are listed."]},"sources":[{"url":"https://github.com/google-gemini/gemini-cli/blob/main/docs/reference/commands.md","kind":"official-source"}],"verification":{"status":"officially-documented","last_verified":"2026-08-30","tested_version":null,"verified_by":["official-source"]}},
  {"id":"gemini-cli.slash-command.resume-save","tool":"gemini-cli","name":"/resume save","display_name":"Save a Gemini checkpoint","type":"slash-command","parent_id":"gemini-cli.slash-command.resume","category":"session","role":"Checkpoint creation","description":"Save the current conversation history under a required project-local tag. Saving a tag and resuming it later is the documented way to fork a conversation: it branches history at that point without losing the original work.","syntax":["/resume save <tag>"],"examples":[{"command":"/resume save before-refactor","explanation":"Create a project-scoped checkpoint before changing files.","level":"practical"}],"maturity":"stable","availability":{"channels":["interactive"],"conditions":["Checkpoints are available from the same project directory where they were saved."]},"sources":[{"url":"https://github.com/google-gemini/gemini-cli/blob/main/docs/reference/commands.md","kind":"official-source"},{"url":"https://github.com/google-gemini/gemini-cli/blob/main/docs/cli/tutorials/session-management.md","kind":"official-source"}],"verification":{"status":"officially-documented","last_verified":"2026-08-30","tested_version":null,"verified_by":["official-source"]},"capabilities":["session.fork"]},
  {"id":"gemini-cli.slash-command.resume-resume","tool":"gemini-cli","name":"/resume resume","display_name":"Resume a Gemini checkpoint","type":"slash-command","parent_id":"gemini-cli.slash-command.resume","category":"session","role":"Checkpoint restoration","description":"Resume a manually saved conversation checkpoint by tag.","syntax":["/resume resume <tag>"],"examples":[{"command":"/resume resume before-refactor","explanation":"Return to a named checkpoint in the current project.","level":"practical"}],"maturity":"stable","availability":{"channels":["interactive"],"conditions":["The checkpoint must have been saved in the current project."]},"sources":[{"url":"https://github.com/google-gemini/gemini-cli/blob/main/docs/reference/commands.md","kind":"official-source"}],"verification":{"status":"officially-documented","last_verified":"2026-08-30","tested_version":null,"verified_by":["official-source"]}},
  {"id":"gemini-cli.slash-command.resume-share","tool":"gemini-cli","name":"/resume share","display_name":"Export a Gemini conversation","type":"slash-command","parent_id":"gemini-cli.slash-command.resume","category":"session","role":"Conversation export","description":"Write the current conversation to a Markdown or JSON file, or generate a filename when omitted.","syntax":["/resume share [filename]"],"examples":[{"command":"/resume share review-notes.md","explanation":"Export the current conversation as a Markdown handoff.","level":"practical"}],"maturity":"stable","availability":{"channels":["interactive"],"conditions":[]},"sources":[{"url":"https://github.com/google-gemini/gemini-cli/blob/main/docs/reference/commands.md","kind":"official-source"}],"verification":{"status":"officially-documented","last_verified":"2026-08-30","tested_version":null,"verified_by":["official-source"]}}
]
